title,url,date,description,img
Insane couple fucking hard til cumshot and squirt on CAM4,https://www.pornhub.com/view_video.php?viewkey=ph61816506603f3,Mon Nov  8 20:06:48 2021,,https://ei.phncdn.com/videos/202111/02/397393441/original/(m=eafTGgaaaa)(mh=ik9uaeB9Z2B1t2-M)10.jpg
Squirting Shower for Steve giving intense anal orgasms with his big dick - Amateur Couple,https://www.pornhub.com/view_video.php?viewkey=ph617c4c8081296,Mon Nov  8 20:06:48 2021,,https://ei.phncdn.com/videos/202110/29/397194121/original/(m=q_3VJ4WbeafTGgaaaa)(mh=cvVUXvmtPM8feLLk)0.jpg
"Record of my favourite brunette fucked in ass, squirting and eating my cum in hotel room",https://www.pornhub.com/view_video.php?viewkey=ph615074c15778d,Mon Nov  8 20:06:48 2021,,https://ei.phncdn.com/videos/202109/26/395362281/original/(m=eafTGgaaaa)(mh=4KJM7p5igjPykfeR)13.jpg
Deep Hard Anal with big dick and huge belly cumshot in Danika's balcony,https://www.pornhub.com/view_video.php?viewkey=ph6147519c526ac,Mon Nov  8 20:06:48 2021,,https://ei.phncdn.com/videos/202109/19/394978131/original/(m=qYU9W0WbeafTGgaaaa)(mh=wTzGajSwAjpd5u1p)0.jpg
Rough sex on a first date with a hot brunette met on sex-dater - Doggy - Cowgirl - Reverse,https://www.pornhub.com/view_video.php?viewkey=ph61279a5145d2a,Mon Nov  8 20:06:48 2021,,https://ei.phncdn.com/videos/202108/26/393629901/original/(m=qWOUWYWbeafTGgaaaa)(mh=F1JWYERUfS0FUs14)0.jpg
Hot horny friend in bathtube gets wet fucking and cumshot on belly - Amateur Couple,https://www.pornhub.com/view_video.php?viewkey=ph611efa847acaf,Mon Nov  8 20:06:48 2021,,https://ei.phncdn.com/videos/202108/20/393245741/original/(m=qKX7-XWbeafTGgaaaa)(mh=E18Olc6fsVSN0YTU)0.jpg
Blowjob and sex with cum swallow after afternoon nap - Amateur Danika Mori,https://www.pornhub.com/view_video.php?viewkey=ph61154da3a9494,Mon Nov  8 20:06:48 2021,,https://ei.phncdn.com/videos/202108/12/392840911/original/(m=eafTGgaaaa)(mh=bNXWVFysUbwKXDcX)6.jpg
Step brother with big fat dick makes his small stepsister squirts & cum with multiple orgasms,https://www.pornhub.com/view_video.php?viewkey=ph60f32f4ae1bf7,Mon Nov  8 20:06:48 2021,,https://ei.phncdn.com/videos/202107/17/391401571/original/(m=q5H8MVWbeafTGgaaaa)(mh=FUn0JB6P_HeoTWyW)0.jpg
The Mori's TOYS - The 3some you must have in your bed!,https://www.pornhub.com/view_video.php?viewkey=ph60c0f14224b34,Mon Nov  8 20:06:48 2021,,https://ei.phncdn.com/videos/202106/09/389339261/original/(m=eafTGgaaaa)(mh=s-K8yVjp3iPTForE)6.jpg
Danika's G-Spot makes me Squirt and ask for Ass Pounding DP and Creampie,https://www.pornhub.com/view_video.php?viewkey=ph60c0000c8ce3f,Mon Nov  8 20:06:48 2021,,https://ei.phncdn.com/videos/202106/09/389301841/original/(m=qPHQGSWbeafTGgaaaa)(mh=zFHkbbS3qI0p2gwb)0.jpg
Danika woke up wet and Steve with his big dick fucked her till squirting and licking it up,https://www.pornhub.com/view_video.php?viewkey=ph60a314c4bbc93,Mon Nov  8 20:06:48 2021,,https://ei.phncdn.com/videos/202105/18/388198081/original/(m=q62HOQWbeafTGgaaaa)(mh=dmk89dCvjnUz2ASN)0.jpg
Registrazione privata durante le vacanze - cavalcare un cazzo e sborrare sulla pancia POV,https://www.pornhub.com/view_video.php?viewkey=ph6095bca18e9e8,Mon Nov  8 20:06:48 2021,,https://ei.phncdn.com/videos/202105/07/387704581/original/(m=qZ2STPWbeafTGgaaaa)(mh=WUBP08JgNFdAVMbZ)0.jpg
Intensa sveltina anale e squirt prima di cena - POV all'aperto,https://www.pornhub.com/view_video.php?viewkey=ph6093362cc6dc6,Mon Nov  8 20:06:48 2021,,https://ei.phncdn.com/videos/202105/06/387607771/original/(m=eafTGgaaaa)(mh=gbUziRUkm4TNzHEw)9.jpg
Eat my pussy and fuck me hard with you big dick - Amateur Couple,https://www.pornhub.com/view_video.php?viewkey=ph605f578ef3850,Mon Nov  8 20:06:48 2021,,https://ei.phncdn.com/videos/202103/27/385765321/original/(m=eafTGgaaaa)(mh=JYiEd3E8nFZwYxVN)12.jpg
Five stars blowjob and fuckface to my big dick from the extra small Danika,https://www.pornhub.com/view_video.php?viewkey=ph6024992baf314,Mon Nov  8 20:06:48 2021,,https://ei.phncdn.com/videos/202102/11/383383592/original/(m=eafTGgaaaa)(mh=04l1jYjxoW7LxZi6)12.jpg
Italian Danika gets ass fucked after masturbating in bathroom,https://www.pornhub.com/view_video.php?viewkey=ph601f6ab953d0c,Mon Nov  8 20:06:48 2021,,https://ei.phncdn.com/videos/202102/07/383144762/original/(m=eafTGgaaaa)(mh=BJvJMtXfUSRqxDPs)4.jpg
Sweet dreams for Steve Mori after breakfast and quickie - pussy creampie,https://www.pornhub.com/view_video.php?viewkey=ph602322385c7e5,Mon Nov  8 20:06:48 2021,,https://ei.phncdn.com/videos/202102/10/383318712/original/(m=eafTGgaaaa)(mh=XfUeLUq7lGm5P_Um)5.jpg
All you want in a threesome with Danika and her best friend - Anal and Squirt,https://www.pornhub.com/view_video.php?viewkey=ph601d90a75fdd2,Mon Nov  8 20:06:48 2021,,https://ei.phncdn.com/videos/202102/05/383069302/original/(m=eafTGgaaaa)(mh=kwvu4ha-FyFmTXKK)10.jpg
Wet Oiled bodies and Double multiorgasmic Squirt by Danika and Martina,https://www.pornhub.com/view_video.php?viewkey=ph600db0945fd7f,Mon Nov  8 20:06:48 2021,,https://ei.phncdn.com/videos/202101/24/382347192/original/(m=eafTGgaaaa)(mh=p7rm6MNLHSryOTlr)15.jpg
The best gift from my boyfriend - Anal and Squirt in my birthday,https://www.pornhub.com/view_video.php?viewkey=ph600b5c05e0aae,Mon Nov  8 20:06:48 2021,,https://ei.phncdn.com/videos/202101/22/382251732/original/(m=eafTGgaaaa)(mh=NuZP_htzOyLxD68-)16.jpg
Danika Mori doing a hot show and squirts on Bongacams,https://www.pornhub.com/view_video.php?viewkey=ph5ff3a2fb49794,Mon Nov  8 20:06:48 2021,,https://ei.phncdn.com/videos/202101/05/379701842/original/(m=eafTGgaaaa)(mh=mZULh87eVYMaQnoH)11.jpg
Riding a big dick in reverse cowgirl for a quickie - Pussy Creampie !,https://www.pornhub.com/view_video.php?viewkey=ph5fd66a762b462,Mon Nov  8 20:06:48 2021,,https://ei.phncdn.com/videos/202012/13/378295192/original/(m=qRJST9VbeafTGgaaaa)(mh=ZH_IeezGrDflmtko)0.jpg
"Sun bath 69! Deep throat, hard sex, squirting and cumshot in terrace",https://www.pornhub.com/view_video.php?viewkey=ph5fd65ca741067,Mon Nov  8 20:06:48 2021,,https://ei.phncdn.com/videos/202012/13/378290762/original/(m=qMR5S9VbeafTGgaaaa)(mh=NYrCVLizSUd0CqDA)0.jpg
"Danika Mori on CAM4 Deep Throat, Amateur Dirty Fuck, oral sex in Cam",https://www.pornhub.com/view_video.php?viewkey=ph5fd3bb4282c97,Mon Nov  8 20:06:48 2021,,https://ei.phncdn.com/videos/202012/11/378177472/original/(m=qUT1Q9VbeafTGgaaaa)(mh=0sVgtdeCuc6lxdt9)0.jpg
Double team Steve Mori and Monster pub for Danika - Remote controlled vibrations,https://www.pornhub.com/view_video.php?viewkey=ph5fbe4e4fb4db8,Mon Nov  8 20:06:48 2021,,https://ei.phncdn.com/videos/202011/25/373666252/original/(m=qXZ487VbeafTGgaaaa)(mh=lPvZPN4BuBJgKsf9)0.jpg
Double interracial bj for Steve's big fat cock - Two brunettes dripping cunts enjoy swallowing,https://www.pornhub.com/view_video.php?viewkey=ph5fba8f1936a1b,Mon Nov  8 20:06:48 2021,,https://ei.phncdn.com/videos/202011/22/372693122/original/(m=eafTGgaaaa)(mh=DENvRx7Syo4elifD)12.jpg
Steve Mori knows how to double fuck - Danika needs more DP in her life!,https://www.pornhub.com/view_video.php?viewkey=ph5faeaea364836,Mon Nov  8 20:06:48 2021,,https://ei.phncdn.com/videos/202011/13/369863612/original/(m=qOT6-8VbeafTGgaaaa)(mh=0nio9DpASVyf0sNB)0.jpg
Long socks for Danika but squirting orgasms warm her up,https://www.pornhub.com/view_video.php?viewkey=ph5fa0881c34050,Mon Nov  8 20:06:48 2021,,https://ei.phncdn.com/videos/202011/02/366365272/original/(m=qGT7SHWbeafTGgaaaa)(mh=fcil_lresDkhQE7i)0.jpg
Perfect round tits girl daining my nuts,https://www.pornhub.com/view_video.php?viewkey=ph5fa0303133aac,Mon Nov  8 20:06:48 2021,,https://ei.phncdn.com/videos/202011/02/366281572/original/(m=eafTGgaaaa)(mh=1_E1YxH_SuMYeG_k)15.jpg
Oil massage leads to rough anal sex and squirt in outdoor- Danika Mori Vacations,https://www.pornhub.com/view_video.php?viewkey=ph5f7012d63b428,Mon Nov  8 20:06:48 2021,,https://ei.phncdn.com/videos/202009/27/355362932/original/(m=qR8UL3VbeafTGgaaaa)(mh=V2gJeEVnyoH0laGU)0.jpg
Tahitian Princess of your dreams gets hard and deep anal - Danika Mori Vacations,https://www.pornhub.com/view_video.php?viewkey=ph5f7000f919b66,Mon Nov  8 20:06:48 2021,,https://ei.phncdn.com/videos/202009/27/355351232/original/(m=eafTGgaaaa)(mh=8LVQCD3mCDRdve4F)8.jpg
Hard Anal for Danika ready to go out with friends - She loves Ass to Pussy,https://www.pornhub.com/view_video.php?viewkey=ph5f6b423e08296,Mon Nov  8 20:06:48 2021,,https://ei.phncdn.com/videos/202009/23/354292592/original/(m=q2MZI3VbeafTGgaaaa)(mh=y7XPxWYKCCd1ewff)0.jpg
I catch my girlfriend masturbating and make her eat my cum,https://www.pornhub.com/view_video.php?viewkey=ph5f624bfcd348b,Mon Nov  8 20:06:48 2021,,https://ei.phncdn.com/videos/202009/16/352382972/original/(m=qJXWI3VbeafTGgaaaa)(mh=B9eMMxCXnBx0dElu)0.jpg
Wet squirt fuck - Pussy to Ass and Ass to Pussy,https://www.pornhub.com/view_video.php?viewkey=ph5f4834fccfe61,Mon Nov  8 20:06:48 2021,,https://ei.phncdn.com/videos/202008/28/346488171/original/(m=qZNVG3VbeafTGgaaaa)(mh=X3-6mVEusAFxQ_sC)0.jpg
She takes it deep and cum multiple times - Amateur Mori's Couple,https://www.pornhub.com/view_video.php?viewkey=ph5f46e18160410,Mon Nov  8 20:06:48 2021,,https://ei.phncdn.com/videos/202008/27/346188601/original/(m=qLQUI3VbeafTGgaaaa)(mh=PjC0XVRg8qH2jR-x)0.jpg
From golden hour to night fucking hard by the window - Stomach Bulge,https://www.pornhub.com/view_video.php?viewkey=ph5f4290bb1a0c9,Mon Nov  8 20:06:48 2021,,https://ei.phncdn.com/videos/202008/23/345164381/original/(m=qXWVL3VbeafTGgaaaa)(mh=lnqGdpmncuAb_a_H)0.jpg
Just met her yesterday - I recorded how she rides on my dick and gets creampie,https://www.pornhub.com/view_video.php?viewkey=ph5f36a92fafad4,Mon Nov  8 20:06:48 2021,,https://ei.phncdn.com/videos/202008/14/342354381/original/(m=q7HQG3VbeafTGgaaaa)(mh=zDDCBV3F5ZHQs_GE)0.jpg
Hard ass fuck makes Danika Mori Shakes of pleasure,https://www.pornhub.com/view_video.php?viewkey=ph5f2e504399c25,Mon Nov  8 20:06:48 2021,,https://ei.phncdn.com/videos/202008/08/340502151/original/(m=qXOXI3VbeafTGgaaaa)(mh=9CnrQ-qm43q47032)0.jpg
Brunch time with Anal sex - Amateur Couple POV,https://www.pornhub.com/view_video.php?viewkey=ph5f206939eba78,Mon Nov  8 20:06:48 2021,,https://ei.phncdn.com/videos/202007/28/337180591/original/(m=q_OYI3VbeafTGgaaaa)(mh=AoOak0mJKYnsdwDJ)0.jpg
Steve Mori doesn't care about neightbourhood and makes me squirt!,https://www.pornhub.com/view_video.php?viewkey=ph5f0af12d8aabd,Mon Nov  8 20:06:48 2021,,https://ei.phncdn.com/videos/202007/12/332352372/original/(m=q9N8I3VbeafTGgaaaa)(mh=tNX-CATmhbT9eu4y)0.jpg
